<?xml version="1.0" encoding="UTF-8"?>
<modelo
    xmlns:xsi='http://www.w3.org/2001/XMLSchema-instance'
    xsi:noNamespaceSchemaLocation='modelo.xsd'>
    <curso>1</curso>
    <ciclo>DAW</ciclo>
    <nombreCiclo>Desarrollo</nombreCiclo>
    <codigoPostal>47689</codigoPostal>
    <comentario>Este    ciclo   tiene   una     inserci√≥n   laboral     de  100%</comentario>
    <temperatura>24.5</temperatura>
    <codigoAsignatura>BD</codigoAsignatura>
</modelo>
